{
  "$schema": "https://json-schema.org/draft/2020-12/schema",
  "type": "object",
  "required": [
    "title",
    "invoice_number",
    "client",
    "date",
    "due_date",
    "line_items",
    "tax_rate",
    "payment_terms"
  ],
  "additionalProperties": false,
  "properties": {
    "title": { "type": "string", "minLength": 1 },
    "invoice_number": { "type": "string", "minLength": 1 },
    "client": { "type": "string", "minLength": 1 },
    "date": { "type": "string", "minLength": 1 },
    "due_date": { "type": "string", "minLength": 1 },
    "line_items": {
      "type": "array",
      "minItems": 1,
      "items": {
        "type": "object",
        "required": ["description", "quantity", "unit_price"],
        "additionalProperties": false,
        "properties": {
          "description": { "type": "string" },
          "quantity": { "type": "number", "minimum": 0 },
          "unit_price": { "type": "number", "minimum": 0 }
        }
      }
    },
    "tax_rate": { "type": "number", "minimum": 0 },
    "payment_terms": { "type": "string", "minLength": 1 },
    "typst_snippets": {
      "type": "object",
      "additionalProperties": false,
      "properties": {
        "footer_note": { "type": "string", "maxLength": 500 }
      }
    }
  }
}
