{
  "title": "Invoice",
  "invoice_number": "INV-2026-0611",
  "client": "Northstar Analytics",
  "date": "2026-06-11",
  "due_date": "2026-07-11",
  "line_items": [
    { "description": "Platform integration — Phase 1", "quantity": 40, "unit_price": 175.0 },
    { "description": "Technical documentation package", "quantity": 1, "unit_price": 2500.0 },
    { "description": "On-site training (half day)", "quantity": 2, "unit_price": 1200.0 }
  ],
  "tax_rate": 8.5,
  "payment_terms": "Net 30. Please remit payment via ACH to account on file. Include invoice number in payment reference."
}
